[
  {
    "question_id": "Q_LANG_0001",
    "prompt_key": "lang.select_language",
    "urla_section": "Global",
    "urla_payload_path": "$.metadata.locale",
    "answer_types": ["single_select"],
    "required": true,
    "category": "language",
    "options": [
      { "value": "en-US", "label": "English" },
      { "value": "es-US", "label": "Español" }
    ],
    "ui": { "widget": "language_picker" },
    "data_class": "PUBLIC"
  },
  {
    "question_id": "Q_VA_0002",
    "prompt_key": "va.veteran_or_surviving_spouse",
    "urla_section": "Global",
    "urla_payload_path": "$.borrowers[0].military_service.is_veteran",
    "answer_types": ["boolean"],
    "required": true,
    "category": "eligibility",
    "ui": { "widget": "yes_no_buttons" },
    "triggers": [
      { "when": { "equals": { "answer": true } }, "then": { "add_flags": ["FLAG_VA_FLOW"] } }
    ],
    "micro_why_key": "va.veteran_or_surviving_spouse",
    "data_class": "PUBLIC"
  },
  {
    "question_id": "Q_PURP_0010",
    "prompt_key": "purpose.loan_purpose",
    "urla_section": "1a. Loan and Property Information",
    "urla_payload_path": "$.loan.loan_purpose",
    "answer_types": ["single_select"],
    "required": true,
    "category": "purpose",
    "options": [
      { "value": "Purchase", "label_key": "loan_purpose.Purchase" },
      { "value": "Refinance", "label_key": "loan_purpose.Refinance" }
    ],
    "ui": { "widget": "radio_group" },
    "triggers": [
      { "when": { "equals": { "answer": "Purchase" } }, "then": { "add_flags": ["FLAG_PURCHASE"] } },
      { "when": { "equals": { "answer": "Refinance" } }, "then": { "add_flags": ["FLAG_REFI"] } }
    ],
    "data_class": "PUBLIC"
  },
  {
    "question_id": "Q_PURP_0011",
    "prompt_key": "purpose.purchase_price",
    "urla_section": "1a. Loan and Property Information",
    "urla_payload_path": "$.property.purchase_price",
    "answer_types": ["currency"],
    "required": false,
    "category": "purpose",
    "ui": { "widget": "currency_input", "currency_format": true, "allow_uncertainty": true },
    "validations": [
      { "type": "range", "args": { "min": 50000 }, "severity": "high" }
    ],
    "data_class": "SENSITIVE"
  },
  {
    "question_id": "Q_PURP_0012",
    "prompt_key": "purpose.refi_reason",
    "urla_section": "1a. Loan and Property Information",
    "urla_payload_path": "$.loan.refinance_purpose",
    "answer_types": ["single_select"],
    "required": false,
    "category": "purpose",
    "options": [
      { "value": "LowerRate", "label_key": "refinance_reason.LowerRate" },
      { "value": "LowerPayment", "label_key": "refinance_reason.LowerPayment" },
      { "value": "CashOut", "label_key": "refinance_reason.CashOut" },
      { "value": "ShortenTerm", "label_key": "refinance_reason.ShortenTerm" },
      { "value": "ConsolidateDebt", "label_key": "refinance_reason.ConsolidateDebt" },
      { "value": "Other", "label_key": "refinance_reason.Other" }
    ],
    "ui": { "widget": "radio_group" },
    "data_class": "PUBLIC"
  },
  {
    "question_id": "Q_PURP_0013",
    "prompt_key": "purpose.current_loan_balance",
    "urla_section": "1a. Loan and Property Information",
    "urla_payload_path": "$.loan.current_mortgage_balance",
    "answer_types": ["currency"],
    "required": false,
    "category": "purpose",
    "ui": { "widget": "currency_input", "allow_uncertainty": true },
    "data_class": "SENSITIVE"
  },
  {
    "question_id": "Q_PURP_0014",
    "prompt_key": "purpose.cash_out_amount",
    "urla_section": "1a. Loan and Property Information",
    "urla_payload_path": "$.loan.cash_out_amount",
    "answer_types": ["currency"],
    "required": false,
    "category": "purpose",
    "ui": { "widget": "currency_input" },
    "data_class": "SENSITIVE"
  },
  {
    "question_id": "Q_ID_0200",
    "prompt_key": "id.full_name",
    "urla_section": "2a. Personal Information",
    "urla_payload_path": "$.borrowers[*].personal_info",
    "answer_types": ["text"],
    "required": true,
    "party_aware": true,
    "category": "identity",
    "ui": { "widget": "text_input", "placeholder": "First Middle Last" },
    "data_class": "SENSITIVE"
  },
  {
    "question_id": "Q_ID_0201",
    "prompt_key": "id.dob",
    "urla_section": "2a. Personal Information",
    "urla_payload_path": "$.borrowers[*].personal_info.date_of_birth",
    "answer_types": ["date"],
    "required": true,
    "party_aware": true,
    "category": "identity",
    "ui": { "widget": "date_picker" },
    "validations": [
      { "type": "date_before", "args": { "reference": "today" }, "severity": "high" },
      { "type": "date_before", "args": { "reference": "today_minus_18_years" }, "severity": "high", "message_key": "validation.must_be_adult" }
    ],
    "micro_why_key": "id.dob",
    "data_class": "RESTRICTED"
  },
  {
    "question_id": "Q_ID_0202",
    "prompt_key": "id.ssn_last4",
    "urla_section": "2a. Personal Information",
    "urla_payload_path": "$.borrowers[*].personal_info.ssn_last4",
    "answer_types": ["ssn_last4"],
    "required": true,
    "party_aware": true,
    "category": "identity",
    "ui": { "widget": "masked_input", "masking": "****" },
    "validations": [
      { "type": "regex", "args": { "pattern": "^[0-9]{4}$" }, "severity": "high", "message_key": "validation.ssn_last4_format" }
    ],
    "micro_why_key": "id.ssn_last4",
    "data_class": "RESTRICTED"
  },
  {
    "question_id": "Q_ID_0203",
    "prompt_key": "id.contact_phone",
    "urla_section": "1b. Contact Information",
    "urla_payload_path": "$.borrowers[*].contact_info.phone_cell",
    "answer_types": ["phone"],
    "required": true,
    "party_aware": true,
    "category": "identity",
    "ui": { "widget": "phone_input" },
    "validations": [
      { "type": "phone_format", "severity": "high" }
    ],
    "data_class": "SENSITIVE"
  },
  {
    "question_id": "Q_ID_0204",
    "prompt_key": "id.contact_email",
    "urla_section": "1b. Contact Information",
    "urla_payload_path": "$.borrowers[*].contact_info.email",
    "answer_types": ["email"],
    "required": true,
    "party_aware": true,
    "category": "identity",
    "ui": { "widget": "email_input" },
    "validations": [
      { "type": "email_format", "severity": "high" }
    ],
    "data_class": "SENSITIVE"
  },
  {
    "question_id": "Q_ID_0205",
    "prompt_key": "id.citizenship",
    "urla_section": "2a. Personal Information",
    "urla_payload_path": "$.borrowers[*].personal_info.citizenship_status",
    "answer_types": ["single_select"],
    "required": true,
    "party_aware": true,
    "category": "identity",
    "options": [
      { "value": "USCitizen", "label_key": "citizenship_status.USCitizen" },
      { "value": "PermanentResident", "label_key": "citizenship_status.PermanentResident" },
      { "value": "NonPermanentResident", "label_key": "citizenship_status.NonPermanentResident" }
    ],
    "ui": { "widget": "radio_group" },
    "data_class": "SENSITIVE"
  },
  {
    "question_id": "Q_ID_0206",
    "prompt_key": "id.marital_status",
    "urla_section": "2a. Personal Information",
    "urla_payload_path": "$.borrowers[*].personal_info.marital_status",
    "answer_types": ["single_select"],
    "required": true,
    "party_aware": true,
    "category": "identity",
    "options": [
      { "value": "Married", "label_key": "marital_status.Married" },
      { "value": "Separated", "label_key": "marital_status.Separated" },
      { "value": "Unmarried", "label_key": "marital_status.Unmarried" }
    ],
    "ui": { "widget": "radio_group" },
    "data_class": "SENSITIVE"
  },
  {
    "question_id": "Q_ID_0207",
    "prompt_key": "id.dependents",
    "urla_section": "2a. Personal Information",
    "urla_payload_path": "$.borrowers[*].personal_info.dependents_count",
    "answer_types": ["number"],
    "required": false,
    "party_aware": true,
    "category": "identity",
    "ui": { "widget": "number_input", "min": 0, "max": 20 },
    "data_class": "PUBLIC"
  },
  {
    "question_id": "Q_ADDR_0210",
    "prompt_key": "address.current",
    "urla_section": "1c. Current Address",
    "urla_payload_path": "$.borrowers[*].current_address",
    "answer_types": ["address"],
    "required": true,
    "party_aware": true,
    "category": "identity",
    "ui": { "widget": "address_autocomplete", "google_places_autofill": true },
    "validations": [
      { "type": "address_complete", "severity": "high" }
    ],
    "data_class": "SENSITIVE"
  },
  {
    "question_id": "Q_ADDR_0211",
    "prompt_key": "address.housing_type",
    "urla_section": "1c. Current Address",
    "urla_payload_path": "$.borrowers[*].current_address.housing_type",
    "answer_types": ["single_select"],
    "required": true,
    "party_aware": true,
    "category": "identity",
    "options": [
      { "value": "Own", "label_key": "housing_type.Own" },
      { "value": "Rent", "label_key": "housing_type.Rent" },
      { "value": "NoRent", "label_key": "housing_type.NoRent" }
    ],
    "ui": { "widget": "radio_group" },
    "triggers": [
      { "when": { "equals": { "answer": "Rent" } }, "then": { "require_questions": ["Q_ADDR_0212"] } }
    ],
    "data_class": "PUBLIC"
  },
  {
    "question_id": "Q_ADDR_0212",
    "prompt_key": "address.monthly_rent",
    "urla_section": "1c. Current Address",
    "urla_payload_path": "$.borrowers[*].current_address.monthly_rent_expense",
    "answer_types": ["currency"],
    "required": false,
    "party_aware": true,
    "category": "identity",
    "ui": { "widget": "currency_input" },
    "data_class": "SENSITIVE"
  },
  {
    "question_id": "Q_ADDR_0213",
    "prompt_key": "address.years_at_address",
    "urla_section": "1c. Current Address",
    "urla_payload_path": "$.borrowers[*].current_address.years_at_address",
    "answer_types": ["number"],
    "required": true,
    "party_aware": true,
    "category": "identity",
    "ui": { "widget": "number_input", "min": 0, "max": 99, "step": 0.5 },